{
  "assessments": [],
  "constraints": [],
  "derivationLimits": { "maxDepth": 4, "maxDerivations": 16 },
  "derivations": [
    {
      "$schema": "https://raw.githubusercontent.com/roryscot/metamap/main/schemas/metamap-derivation.schema.json",
      "context": { "environment": "example" },
      "contextDigest": "sha256:4abe06bfb6c6b97913a58b9dd17b5cee81397238ed3ceeb372b4eddd94dc52b9",
      "dependencies": [
        {
          "digest": "sha256:88c89f2984754b14e0d5ed6f4397bed16aedaeb6598e5166bee9a8a10cb96d33",
          "id": "urn:example:consumer-service"
        },
        {
          "digest": "sha256:d634f2df4730001431ced4bc34138ff3774e67a581d352678ebf2a93e193959b",
          "id": "urn:example:service-schema"
        }
      ],
      "depth": 1,
      "derivationCount": 1,
      "digest": "sha256:0d11d8d14b23f1cee0dad7a60ed7fab4bb9bd1856befa1c6a5baaf61650fe153",
      "id": "urn:metamap:derivation:0d11d8d14b23f1cee0dad7a60ed7fab4bb9bd1856befa1c6a5baaf61650fe153",
      "interpretation": "declared-law-application",
      "premises": [
        {
          "digest": "sha256:88c89f2984754b14e0d5ed6f4397bed16aedaeb6598e5166bee9a8a10cb96d33",
          "mapping": "urn:example:consumer-service"
        },
        {
          "digest": "sha256:d634f2df4730001431ced4bc34138ff3774e67a581d352678ebf2a93e193959b",
          "mapping": "urn:example:service-schema"
        }
      ],
      "result": {
        "cardinality": "one-to-one",
        "id": "urn:example:consumer-schema",
        "lossiness": "lossless",
        "provenance": {
          "assertedBy": "urn:metamap:example:law:dependency-chain",
          "status": "inferred"
        },
        "relation": "example:depends",
        "sources": ["urn:example:consumer"],
        "targets": ["urn:example:schema"]
      },
      "rule": {
        "id": "urn:metamap:example:law:dependency-chain",
        "imports": [],
        "pack": {
          "digest": "sha256:62b9ea2ead7915d9ff855230080cc4c0b0cc02552b4b287c50be12afdf0063d3",
          "id": "urn:metamap:example:relation-pack:dependencies",
          "version": "1.0.0"
        }
      },
      "schemaVersion": "1.0.0",
      "uncertainty": [
        {
          "assessments": [],
          "dimension": "identity",
          "evidence": [],
          "measurementModels": [],
          "sourceRevisions": [],
          "status": "unknown"
        },
        {
          "assessments": [],
          "dimension": "context",
          "evidence": [],
          "measurementModels": [],
          "sourceRevisions": [],
          "status": "unknown"
        },
        {
          "assessments": [],
          "dimension": "provenance",
          "evidence": [],
          "measurementModels": [],
          "sourceRevisions": [],
          "status": "unknown"
        },
        {
          "assessments": [],
          "dimension": "completeness",
          "evidence": [],
          "measurementModels": [],
          "sourceRevisions": [],
          "status": "unknown"
        },
        {
          "assessments": [],
          "dimension": "causal-relevance",
          "evidence": [],
          "measurementModels": [],
          "sourceRevisions": [],
          "status": "unknown"
        },
        {
          "assessments": [],
          "dimension": "conflicting-authority",
          "evidence": [],
          "measurementModels": [],
          "sourceRevisions": [],
          "status": "unknown"
        }
      ]
    }
  ],
  "evidence": [],
  "graph": {
    "digest": "sha256:567b24c8c2e3e246ebb49b0b9fa10254d5c39853d66c93735e4bb4f502a263de",
    "id": "urn:metamap:example:dependency-graph"
  },
  "id": "urn:metamap:example:dependency-policy",
  "mappings": [
    {
      "coverage": "total",
      "determinism": "deterministic",
      "reversibility": "reversible",
      "select": { "relations": ["example:depends"] }
    }
  ],
  "riskBudgets": [],
  "schemaVersion": "2.0.0",
  "uncertaintyRequirements": []
}
